{
  "schema_version": "decision.v1",
  "decision_id": "dec_Z7A1",
  "ts": "2026-10-05T08:33:00.000000000Z",
  "scope": "session",
  "target_id": "fp_0CB92",
  "cell_id": "ftp-cell-01",
  "decision_type": "alert",
  "confidence": "medium",
  "severity": "low",
  "reason_summary": "repeated auth failures on lure account",
  "evidence_refs": ["evt_SSYV5G"],
  "policy_refs": ["credential-abuse.v1"],
  "recommended_action": "alert",
  "executor_status": "pending",
  "decision_version": "2026-10-05.1",
  "source": "deterministic_rule"
}
